{
  "meta": {
    "tema": "anatomia-11j",
    "titulo": "La anatomía de la represión del 11J",
    "subtitulo": "Quién pagó el precio de salir a la calle el 11 de julio de 2021",
    "actualizado": "2026-06-27",
    "fuente": "Justicia 11J / Cubalex",
    "descripcion": "Este expediente documenta la anatomía demográfica y penal de la represión desatada tras las protestas del 11 de julio de 2021 en Cuba, a partir de 1.130 casos individuales documentados por las organizaciones Justicia 11J y Cubalex. Entre los casos documentados, el 83,6% son hombres y el 16,4% mujeres, aunque la proporción de mujeres sube hasta el 26% entre los detenidos más jóvenes. La edad mediana es de 30 años; se documentan 32 menores de edad, el más joven de 14 años. Al último reporte disponible, el 50,5% de las personas documentadas seguía en detención. Geográficamente, La Habana concentra 353 de los 1.130 casos, seguida de Santiago de Cuba (176), Mayabeque, Matanzas, Villa Clara, Artemisa y Holguín (85-87 casos cada una), Camagüey (49), Cienfuegos (29), Guantánamo (18), Las Tunas y Sancti Spíritus (17 cada una), Isla de la Juventud (15), Granma (11), Ciego de Ávila (7) y Pinar del Río (4). El expediente desglosa la composición demográfica por siete bandas de edad. En la banda de 14 a 17 años (32 casos con edad conocida), las mujeres representan el 25% y un 40,9% de quienes tienen dato racial documentado no son blancos, sobre una base de 22 personas. En la banda de 18 a 24 años (151 casos), las mujeres suben al 26%, el porcentaje más alto de todas las bandas, con un 38% no blanco sobre 108 casos con dato. Las bandas de 25 a 34 años (213 casos) y 35 a 44 años (131 casos) muestran proporciones de mujeres del 16% y 19,8% respectivamente, con cifras de población no blanca en torno al 38-39%. En conjunto, sobre 626 personas con edad documentada, el 16,4% son mujeres, y sobre 658 personas con dato racial documentado, el 39,8% no son blancas. El expediente compara la distribución de edad entre quienes seguían en detención y quienes fueron excarcelados: los que permanecen detenidos tienen una edad mediana de 31 años (rango intercuartílico de 25 a 40 años), ligeramente superior a la de los excarcelados, con mediana de 29 años (rango de 22 a 38 años), lo que sugiere que la excarcelación ha favorecido en algo mayor medida a los más jóvenes. Sobre los cargos penales, el expediente documenta ocho categorías con su prevalencia entre los casos: desórdenes públicos (69,7%), desacato (40,8%), atentado (37,3%), sedición (21,9%), instigación a delinquir (12,2%), sabotaje (7,5%), daños (7,1%) y propagación de epidemias (6,6%); muchos casos combinan varios cargos simultáneamente. La condena mediana asociada a cada cargo varía notablemente: sedición conlleva la condena más severa, con una media de 10 años, seguida de sabotaje (9,6 años), daños (8,7 años), instigación a delinquir (8,4 años) y propagación de epidemias (8 años); desórdenes públicos, desacato y atentado promedian entre 6,9 y 7,6 años. La condena mediana global de los casos del 11J es de 7 años de prisión por participar en las protestas. El expediente sitúa estos datos en un contexto carcelario más amplio: Cuba tiene aproximadamente 90.000 personas presas en total, según el World Prison Brief, con una tasa de 794 presos por cada 100.000 habitantes, la segunda más alta del mundo después de El Salvador; esto equivale a que 1 de cada 126 cubanos está tras las rejas. Las mujeres representan solo el 7,4% de la población penal general cubana, frente al 16,4% entre los casos documentados del 11J —una sobrerrepresentación femenina de más del doble entre quienes fueron represaliados por protestar, respecto a la población carcelaria general.",
    "narracion": "Este expediente disecciona la represión que siguió a las protestas del once de julio de 2021 en Cuba, a partir de mil ciento treinta casos individuales documentados por Justicia Once Jota y Cubalex. Ocho de cada diez detenidos son hombres, pero entre los más jóvenes la proporción de mujeres sube al veintiséis por ciento. La edad mediana es de treinta años; hay treinta y dos menores de edad documentados, el más joven de catorce. Al último recuento, la mitad seguía en detención. La Habana concentra trescientos cincuenta y tres casos y Santiago de Cuba ciento setenta y seis. La condena mediana por participar en las protestas es de siete años de cárcel; la sedición, el cargo más severo, promedia diez. El contexto agrava el cuadro: Cuba tiene unas noventa mil personas presas, la segunda tasa de encarcelamiento más alta del mundo, uno de cada ciento veintiséis cubanos. Y las mujeres, que son el siete por ciento de la población penal general, son el dieciséis por ciento de los casos del once de julio: el doble de sobrerrepresentación entre quienes fueron castigados por protestar. Cinco años después, los datos dicen lo que la propaganda calla: fue un castigo masivo, joven y desproporcionado.",
    "narracion_en": "This file documents who paid the price for taking to the streets on July eleventh, twenty twenty-one, in Cuba, based on one thousand one hundred thirty documented cases from the organizations Justicia Once de Julio and Cubalex. Among the documented cases, eight out of ten are men, and just over one in six are women, though that share rises to more than a quarter among the youngest detainees. The median age is thirty; there are thirty-two documented minors, the youngest just fourteen years old. More than half of those documented were still in detention as of the latest report. Havana accounts for a third of all cases, with three hundred fifty-three. Santiago de Cuba follows, with one hundred seventy-six. The rest is spread across Mayabeque, Matanzas, Villa Clara, Artemisa, and Holguín, each with between eighty-five and eighty-seven cases, and then the remaining provinces with smaller numbers. By age, the youngest band, fourteen to seventeen years old, has the highest share of non-white people among those with known racial data. The eighteen-to-twenty-four band has the highest share of women, more than a quarter. Overall, among those with documented racial data, close to four in ten are non-white. The file compares the age of those still detained with those released: those still detained have a median age of thirty-one, somewhat older than those released, whose median age is twenty-nine, suggesting release has somewhat favored younger people. On criminal charges, the most common is public disorder, present in more than two-thirds of cases, followed by contempt of authority and assault. But the harshest charge in terms of sentence is sedition, averaging ten years in prison, well above the rest. The median sentence across all July eleventh cases is seven years in prison for protesting. The file places all this within a much broader prison context: Cuba holds around ninety thousand people in prison overall, with a rate of nearly eight hundred prisoners per one hundred thousand people, the second highest in the world, behind only El Salvador. That means one out of every one hundred twenty-six Cubans is behind bars. Women make up just seven percent of Cuba's general prison population, but account for more than sixteen percent of the documented July eleventh cases: more than double their usual share among those punished for taking to the streets."
  },
  "total": 1130,
  "stats": [
    {
      "n": "83,6 %",
      "l": "hombres",
      "s": "entre los casos documentados",
      "color": "petrol"
    },
    {
      "n": "16,4 %",
      "l": "mujeres",
      "s": "hasta 26 % entre los más jóvenes",
      "color": "marigold"
    },
    {
      "n": "30",
      "l": "edad mediana",
      "s": "32 menores; el más joven, 14",
      "color": "paper"
    },
    {
      "n": "50,5 %",
      "l": "seguía en detención",
      "s": "último reporte",
      "color": "clay"
    }
  ],
  "prov": [
    {
      "p": "La Habana",
      "c": 353
    },
    {
      "p": "Santiago de Cuba",
      "c": 176
    },
    {
      "p": "Mayabeque",
      "c": 87
    },
    {
      "p": "Matanzas",
      "c": 87
    },
    {
      "p": "Villa Clara",
      "c": 85
    },
    {
      "p": "Artemisa",
      "c": 85
    },
    {
      "p": "Holguín",
      "c": 85
    },
    {
      "p": "Camagüey",
      "c": 49
    },
    {
      "p": "Cienfuegos",
      "c": 29
    },
    {
      "p": "Guantánamo",
      "c": 18
    },
    {
      "p": "Las Tunas",
      "c": 17
    },
    {
      "p": "Sancti Spíritus",
      "c": 17
    },
    {
      "p": "Isla de la Juventud",
      "c": 15
    },
    {
      "p": "Granma",
      "c": 11
    },
    {
      "p": "Ciego de Ávila",
      "c": 7
    },
    {
      "p": "Pinar del Río",
      "c": 4
    }
  ],
  "comp": [
    {
      "band": "Todas",
      "nEdad": 626,
      "sexo": {
        "m": 16.4
      },
      "raza": {
        "nm": 39.8,
        "nK": 658
      }
    },
    {
      "band": "14–17",
      "nEdad": 32,
      "sexo": {
        "m": 25.0
      },
      "raza": {
        "nm": 40.9,
        "nK": 22
      }
    },
    {
      "band": "18–24",
      "nEdad": 151,
      "sexo": {
        "m": 26.0
      },
      "raza": {
        "nm": 38.0,
        "nK": 108
      }
    },
    {
      "band": "25–34",
      "nEdad": 213,
      "sexo": {
        "m": 16.0
      },
      "raza": {
        "nm": 37.9,
        "nK": 153
      }
    },
    {
      "band": "35–44",
      "nEdad": 131,
      "sexo": {
        "m": 19.8
      },
      "raza": {
        "nm": 39.1,
        "nK": 92
      }
    },
    {
      "band": "45–54",
      "nEdad": 73,
      "sexo": {
        "m": 17.8
      },
      "raza": {
        "nm": 35.9,
        "nK": 39
      }
    },
    {
      "band": "55+",
      "nEdad": 26,
      "sexo": {
        "m": 11.5
      },
      "raza": {
        "nm": 33.3,
        "nK": 21
      }
    }
  ],
  "edad": {
    "grid": [
      14,
      16,
      18,
      20,
      22,
      24,
      26,
      28,
      30,
      32,